{"decision_id":"ADR-P-STORAGE-001","title":"Project P reversible storage adapter candidate","status":"review-required","decision_mode":"DECISION_CANDIDATE","disposition":"DECISION_CANDIDATE","effective_status":"NOT_EFFECTIVE","reason_code":"A2_CURRENT_EXTERNAL_AUTHORITY_EXACT_SCOPE_MATCH","exact_target":{"id":"project-P","digest":"sha256:T"},"baseline":{"id":"main","digest":"sha256:B"},"context":"Select one reversible storage adapter candidate for project P. Authority gov://P/grants/G-17 externally authorizes SARCHI for this A2 candidate-only decision on the exact target and baseline from 2026-08-01 through 2026-08-31; it is current, unrevoked, and unconsumed. No mutation, merge, publication, deployment, activation, risk acceptance, evidence acceptance, or promotion is authorized.","options":[{"name":"PostgreSQL","summary":"Durable storage suited to concurrent workloads.","tradeoffs":["Stronger multi-process concurrency","Higher operational cost"]},{"name":"SQLite","summary":"Simple embedded storage with lower operational overhead.","tradeoffs":["Simpler operation","Weaker multi-process concurrency"]}],"decision":"PostgreSQL","consequences":["Supports durable concurrent access.","Introduces database provisioning, maintenance, backup, and monitoring costs.","Reversible by implementing the storage boundary as an adapter and migrating data to another adapter under separate authority.","This candidate does not authorize implementation or any reserved-gate transition.","Human project governance must review and ratify or reject the candidate before separately authorizing implementation or effectiveness."],"evidence_refs":["fixture://project-P/storage-options","fixture://project-P/target/sha256:T","fixture://project-P/baseline/sha256:B"],"authority_evidence_refs":["gov://P/grants/G-17"],"owner":"SARCHI","approver":null,"review_triggers":["Target project-P digest differs from sha256:T","Baseline main digest differs from sha256:B","Authority expires, is revoked, or is consumed","Concurrency, durability, operational-cost, or reversibility assumptions materially change","Implementation, merge, publication, deployment, activation, risk acceptance, evidence acceptance, or promotion is proposed"],"supersedes":null}
